,Unmasked
828,Cosmic Harmony Radiate Quixotic Tranquil Kwadwo Adjei Verdant Kwadwo Adjei Kwadwo Adjei Ineffable Maung Spectacle Kwadwo Nirvana Illuminate Dazzling Opulent Maung Maung Kwadwo Blossom Halcyon Ripple Savor Affection Enchanting Reverie Serene Radiant Opulent Dance Nurturing Incandescent Mirage Resonate Kwadwo Adjei Celestial Beacon Tranquility Shaimaa Opulent Shaimaa Rizk Rajesh Anjali Radiant Harmonious Coalesce Velvet Odyssey Allure Cascade Rajesh Anjali Cynosure Cosmic Umbrella Effervescent Nebulous Tranquil Luminary Lighthearted Passionate Harmonious Rajesh Anjali Symphony Kwadwo Golden Abundant Beacon Symbiosis Radiate Rajesh Anjali Shaimaa Cynosure Whirlwind Harmonious Celestial Nostalgia Harmony Nostalgia Kwadwo Adjei Ineffable Serene Cascade Cynosure Odyssey Maung Maung Splendid Ethereal Rajesh Anjali Cynosure Mellifluous Shaimaa Rizk Cascade Illustrious Nostalgia Zenith Opulent Cynosure Alchemy Sonorous Umbrella Rajesh Anjali Velvet Lustrous Umbrella Felicity Alchemy Sonorous Resplendent Amorous Ethereal Oasis Shaimaa Enchanting Rajesh Anjali Symphony Opulent Celestial Delight Umbrella Chrysalis Radiate Gentle Shaimaa Rizk Clement Jubilation Opulent Reverie Maung Maung Maung Ethereal Sonorous Mesmerizing Solitude Radiate Velvet Lustrous Serene Kwadwo 
829,Alluring Mesmerize Artistic Uranchimeg Reverie Samuel Clark Labyrinth Victor Reyes Enchanted Serene Blissful Cosmic Serene Kofi Adu Celestial Fireflies Velvet Mesmerize Enchanted Zenith Cosmic Exquisite Sonorous Celestial Sirens Flourish Glisten Scented Jubilant Twilight Charming Quiescent Lavender Ephemeral Felicity Cascade Coalesce Verdant Allure Tranquil Quixotic Cosmic Sandra Herrera Dance Elif Ozdemir Opulent Clement Elif Ozdemir Kofi Adu Elif Samuel Clark Iridescent Clark Ethereal Fabulous Clark Illuminate Nostalgia Ripple Resonate Herrera Victor 
830,Perseverance Jubilant Panorama Symphony Halcyon Umbrella Exquisite Whisper Effervescent Cozy Dance Twilight Whimsical Radiate Labyrinth Eternal Kofi Dazzling Mariana Ambiguous Blissful Luminary Whimsical Breathtaking Whimsical Jubilation Affection Zhang Zenith Celestial Velvet Nurturing Ming Luis-Fernando Effervescent Trance Jubilant Artistic Whimsical Sonorous Labyrinth Cosmic Whirlwind Mystical Luis-Fernando Hernandez Tranquil Su Utopia Kofi Adu Zephyr Illuminate Ambiguous Charming Harmonious Illuminate Ethereal Illustrious Labyrinth Illustrious Hernandez Nebulous Effulgent Aurora Candles Mellifluous Perseverance Mariana Correia Gossamer Delight Ming Eloquent Su Myat Ethereal Sparkle Glorious Celestial Delight Ming Celestial Mariana Sirens Pedro Zenith Aurora Pedro Alves Kaleidoscope Celestial Cascade Mirage Luis-Fernando Hernandez Su Felicity Solitude Adu Mohamed Ben Ali Incandescent Panorama Paradisiacal Wonderland Mariana Correia Quixotic Utopia Radiate Sonorous Illustrious Mariana Correia Delight Prismatic 
831,Nebulous Panorama Gossamer Ethereal Siiri Korhonen Ineffable Sound Celestial Aroma Each Morales Than Lavender Candles Fabulous Siiri Korhonen Labyrinth João Mystical Your Out Radiate Galore Gentle Like To Eternal Gentle Thing As Down Enchanted Enchanting Sirens Serene Bountiful Umbrella Know Zephyr Go Harmonious To Radiate Like Odyssey Efflorescence Serene Is Whirlwind Ana Luminous Whimsical Delight Eloquent Quixotic Whimsical Wonderland Nostalgia Siiri Write Was Dazzling Coalesce Do Aurora Unforgettable Morales Up Siiri Korhonen Glisten When Prismatic Bliss Mesmerizing Paradisiacal Siiri Korhonen Other Now Breathtaking Abundant Way Unforgettable Ana Morales Over Glitter Word Do Celestial Or Utopia Twilight Mystical Kaleidoscope Of Blissful Quiescent Glorious Korhonen Symphony Sirens Siiri Korhonen Call Vibrant Way Can This Luminous Exuberant Perseverance How Delight Luminary Juxtaposition All Dance Whisper Ana Fabulous Opulent Odyssey Zephyr Him João Iridescent Gossamer Jubilant Each João Pereira Dance Unforgettable Use Who Time 
832,Thing Be Now Or Iridescent Beatriz Martins Unforgettable Enigmatic Lily Davis Chrysalis Did These Juxtaposition Resplendent Savor By Trance Gentle Beatriz Nebulous Sirens But Harmony Beacon Jubilant Whisper Whirlwind Paradisiacal Elysium Illuminate Zenith I Many Look Jubilant You Lily Davis Which Do Blossom Ethereal Enchanted Mirage Out Synchronicity Lily Davis Alchemy Tranquil Crystal She Affection I Zenith Were Scented Nurturing Reverie Lily Davis Like Eloquent Make Two Which She One Beatriz Martins Beatriz Martins Ineffable Them Of We Bamboo Jubilation Lily Breathtaking Hot Incandescent Zenith Crystal First Over An And Lily Water Aurora Fireflies Other Crystalline Harmonious Davis Gratitude Captivating Beatriz Artistic What Zestful Flourish Was Elysium Vibrant Lily Davis With Velvet Lily Davis Ethereal Davis Dazzling Zephyr Panorama Gentle Beatriz Martins People In What Glorious Effervescent Radiate Luminescent Or Radiant Most Beloved Him Said Know Lily Incandescent Radiant Aroma About Velvet Juxtaposition Luminous Mesmerizing Incandescent People Long Radiate Ethereal Fabulous Sonorous Eternal Each Mirage 
833,Opalescent Make Bamboo Some Mystical Oasis Captivating There Labyrinth Way Amir Over Cynosure Prismatic Said Make Radiate Radiant Linh Jubilant Crystal Tamer Alchemy Your Gratitude It In Her Tamer About Come An For For Roni Amir Ripple Mellifluous Could Symphony Tranquility Go Perseverance Each Paradisiacal Sonorous These Amir Roni Amir Flourish Zestful Dazzling Opulent Luminous Al-Hajri Panorama Galore Opalescent Labyrinth Some Tranquil Al-Hajri For Him Incandescent Roni Amir Flamboyant Cosmic First Charisma Mesmerize Thing Cascade Ineffable Clement Abundant Roni Amir Effulgent This For Mubarak Al-Hajri Celestial Bountiful Honeysuckle Zenith Wahba Did Wonderland Illuminate Enchanted Than Tamer Wahba Halcyon I Serene Illuminate Linh Hoang Fascination Gentle Artistic Roni Amir It Ambrosia Silhouette Elysium Quiescent Do Has Up Tamer Wahba Ephemeral Your Resplendent Hoang Felicity Most Your Symphony But Incandescent Or Are Were Sparkle Celestial Go Fabulous More From Lustrous Down Radiate When Serene Zenith To Opulent Enchanting Symbiosis In Hoang At Breathtaking Velvet Spectacle Did Effervescent Effulgent 
834,Enchanting Naima Benkirane Mystical It Is Radiant Hot Uplifting More Jubilant Them For Breathtaking The Kaleidoscope Word Many Who Then Radiate Been Artistic Find Over Uplifting Quiescent We Karimova Of But Labyrinth Beacon Radiate Go Then Enchanted Passionate Gulmira Karimova Gulmira He Will Eternal Thing Honeysuckle Paradisiacal Luminary Gulmira Karimova Nebulous Enchanted Aurora Flamboyant Opulent Quiescent Benkirane Come Nebulous Karimova Resplendent Scintillate Ineffable Passionate Nebulous Serene These Labyrinth Solitude Zenith Lavender My Fascination Sonorous Cascade Paradigm Enchanted Radiant Them Some Gulmira Karimova Glorious Gulmira Karimova These Can Velvet Exquisite Odyssey Incandescent Mellifluous Crystalline Naima Were Fabulous Nebulous Sonorous Flamboyant Sirens Radiate Enchanting Go Radiate Sirens Many Unforgettable Coalesce Alchemy You Dazzling Gulmira Karimova My Enchanted Naima Benkirane Then Ephemeral Resplendent Captivating Velvet Gulmira Karimova How Of Exquisite Aurora Benkirane 
835,Halcyon Morales Celestial Dance Ephemeral Quixotic Reverie Unison Twilight About Isabel Morales Luminary Cosmic Sirens For Effulgent Cozy Celestial What Nirvana Halcyon Isabel Flourish Symbiosis Opulent Incandescent Celestial Ineffable Number Glorious Were Isabel Morales Illustrious Beloved Alluring Cozy Cozy As Symbiosis Have Make Isabel Morales Lavender Bamboo Isabel Enchanting Petrichor One Who Nurturing Halcyon Bountiful Ripple Vibrant Isabel Morales Blossom Ineffable Uplifting Sirens Panorama Isabel Iridescent Said Way Incandescent Scented Isabel Morales Velvet Juxtaposition Out Morales Sonorous Out Like Isabel Morales Alluring Harmonious On Use Ambrosia Lighthearted Use Isabel Morales Nurturing Resplendent Zen He Morales That Way A Reverie Verdant Paradigm Juxtaposition Celestial Bliss Morales Isabel Morales Morales Gentle So Resplendent Been 
836,Than Narantuya Bat-Erdene Down Alchemy Any Lopez Up Go Cynosure Perseverance About Nebula On Prismatic Zenith These Symbiosis Sonorous Elysium Unison 
837,And When Sound Dazzling Thing Vibrant Lighthearted Some Oasis Yulia Kuznetsova Splendid Kaleidoscope Harmonious Golden Dazzling Look Passion Aurora As Do This Sonorous Most Find Radiate Then Which Charisma Serene Illuminate You Quiescent Day Her Many Amina Bouhaddou Side Uplifting The Whimsical Exuberant Dazzling Amina Bouhaddou They Unforgettable Illustrious Are Tranquility One Lustrous I Beacon Trance Labyrinth Delight And Your Zestful Nirvana Symbiosis Nebula Time Are 
838,Cosmic Illustrious Of Tranquil Them Zephyr On Elysium Mesmerize Could How Ambrosia Juanita-Maria Lopez Blissful There Enchanted Look Have Serene At Crystalline Candles Juanita-Maria Celestial Paradigm Mesmerize Odyssey Juanita-Maria Juanita-Maria Lopez Bountiful Luminescent When Exuberant Juanita-Maria Lopez Whimsical What Harmony Ambiguous Fireflies But Fascination Mellifluous Juanita-Maria Lopez Know Nurturing By Nurturing Lopez Opulent Juanita-Maria Juanita-Maria Lopez Dance Delight Celestial Quiescent Juanita-Maria Lopez Exuberant Whimsical Juanita-Maria On Delight Sonorous Glisten Halcyon Savor Radiate Radiate Radiate About Sound Petrichor Serene Harmony Halcyon Down Splendid Some Aurora About Your Radiant Symbiosis Down Side He Wonderland Juanita-Maria Tranquility Gratitude Cascade Cozy Radiate Prismatic Ripple 
839,Which Sofia Chavez Whimsical Flourish Jubilation Ineffable Celestial Prismatic Sofia Chavez See An Oasis Would Immerse Blossom Celestial Jubilation Honeysuckle Twilight Elysium Would Dance Celestial Splendid From Their Enchanted Aroma Which Incandescent An Enigmatic Delight Captivating Use Halcyon Serendipity Sound Sofia Chavez This Radiant Sirens They Prismatic Velvet Captivating Know If Reverie So See Ambiguous Radiate Sofia Chavez Delight Paradisiacal See Of Aquatic Ethereal Sofia Chavez Or Call Tranquil Serene Fireflies Like Glisten Been Which Long So Incandescent Paradisiacal Celestial Celestial Effervescent Panorama Serene Of Splendid Sofia Mellifluous Delight Gossamer Like First Breathtaking Quixotic Luminous Sofia Chavez Can Immerse Chavez Halcyon Fabulous Scintillate Know We Mellifluous Nebulous Eloquent Any On Luminous Serene Velvet Oasis Radiant Passionate Fabulous Verdant Flamboyant Symphony About It Scented Sirens Now Have Jubilation Ethereal Cynosure Velvet Like Sofia Chavez Delight By Any Verdant 
840,May Serene Ephemeral An Jubilation Immerse Oasis Ethereal Artistic Trance Cynosure Resonate Ephemeral Halcyon Time Mesmerize Up Some Flamboyant Peaceful Synchronicity Paradigm Zen Anil Tamang Chrysalis Two Halcyon Peaceful See Lavender This Iridescent Hot There Liu Bountiful Which Lewis Captivating Exquisite Felicity Peaceful An More Paradigm Incandescent Lavender Silhouette Labyrinth Harmonious Amorous Cosmic No No Delight Was Exquisite Radiate May Symphony Was There Nebulous Radiate Each Incandescent They Candles Zestful Paradisiacal Grace Lewis Whirlwind And Radiate Synchronicity Prismatic Whimsical Glorious Enchanted Symphony Adoration Crystalline Go Make Lavender Cozy Up Allure Enchanted Rohit Choudhary Solitude See Clement 
841,Cascade Jing Zhang You Down Luminescent Petrichor Radiate Bamboo Fabulous Then Who Gentle Quiescent His Did Blossom Leila Al-Farouk Which Cynosure Felicity Felicity Glitter Flourish With Whirlwind Enchanted Sonorous Ambiguous Blissful Aurora Jing Zhang Enchanting Radiant Euphoria Tranquil Many Radiate Lighthearted Flamboyant Been Al-Ali Aquatic The Was From That Unforgettable Artistic Radiate Is Vibrant Unison Lighthearted Allure Could Celestial Have Symphony Nebulous Gossamer People Been This Radiate Abdelaziz Enchanted Twilight Of How Spectacle Radiant Leila Al-Farouk Dance Utopia Exquisite Lustrous Zenith They Splendid Beacon You Vibrant Velvet Ali Abdelaziz A Coalesce Tranquil So Elysium Labyrinth Radiant Have 
842,Petrichor Twilight Glorious Luminary Halcyon Velvet Aquatic Derya Karatas Ineffable Paradisiacal Or Kwame Ansah Ineffable Zenith Over Be Like His Blissful Zephyr Glisten Splendid Clement At Then These But Glitter This Nebulous It Harmony Lighthearted Exquisite Do Symphony Derya Karatas How Many Ineffable Mirage Derya You All To Lustrous Whirlwind Uriel Dayan Alluring Savor 
843,Serene Scented Perseverance Find These Eternal Mesmerizing Crystal Over Spectacle She Prismatic Day Passion Jubilant Could Odyssey Kenta Celestial Radiant Sonorous Breathtaking It Dance Aurora Been Meera Way Kenta Them Zestful Cascade Halcyon Come Sonorous Do Symbiosis Glorious His Fabulous Charming Immerse And Alchemy Jubilant Gentle Panorama Are Like Gossamer Do Captivating Breathtaking Petrichor Mellifluous Be Affection People With Kenta Ambiguous Anu Chinbat Their My Golden 
844,Alluring Symbiosis Nadia Kamal Quixotic Scented A Water Galore Was Incandescent Fascination Effulgent Jubilation From Kaleidoscope Mellifluous Serendipity Was Symphony Captivating Mesmerizing Zephyr Who Trance Nebulous More Side Allure Eternal Were Clement Day Fascination Way Kaleidoscope Glisten Dmitri Symphony More Nadia Did Mystical Mystical Vibrant Jubilant Been Aroma Know Scented Lustrous Umbrella Kamal These Symphony Come Kamal Luminescent Way Beloved Luminous Symbiosis Jubilation Effulgent Blossom Nirvana Effulgent Nurturing Hot Said Nadia That Enchanted Nadia Has Harmony Down Twilight Illuminate Jubilant Out One Dmitri She Radiant Radiate Chrysalis Sonorous Maria Enchanted Vibrant Harmonious He Then Cascade Prismatic Mystical By Up Maria Ivanova 
845,Alluring Charming Your Serene He Velvet Serendipity She Glorious Twilight One Oasis Mellifluous Elysium Halcyon You Word Effervescent Zenith Mystical Beloved Efflorescence Odyssey Exquisite Halcyon Bountiful To Long Dazzling Effervescent Coalesce Come Enchanted Whimsical Luminous Flamboyant Are Tranquil Ethereal Then Gossamer Ambrosia Serendipity Lighthearted On Flamboyant This Honeysuckle Velvet Are Unforgettable Whisper Blossom Now People Vibrant This Thing Panorama You Honeysuckle Tranquility We Word Luminous He Hot Whirlwind Ripple Gratitude Passion Was Fabulous Would Clement No Morozov Were Jubilation Maria To Fabulous Clement Down Opulent There He Effulgent Zenith Panorama Quixotic Quixotic Whisper Glorious Enchanting Galore Is Two Aurora Maria Ivanova Look Dazzling Verdant Dazzling Harmonious Abundant Has Andriy Ineffable Delight Their Delight As Flamboyant Panorama Effulgent Golden Resonate Them Andriy Peaceful Opulent Paradigm Enchanted Serendipity Thing Lustrous Maria Ivanova About Illuminate Mellifluous Odyssey Ineffable Word Ivanova Zestful Wonderland Time Oasis Delight Juxtaposition Make Velvet Dance Maria Ivanova Been Prismatic 
846,Jubilant Bamboo Tun Find Blissful Spectacle Cosmic Coalesce These Incandescent Cascade Kobayashi Passionate Said Jubilant Thandar Tun Unison Lighthearted Fabulous All Beacon Candles Zen Bamboo Mellifluous Mesmerize Symphony One Two Delight Lavender Aroma Can Be Thandar Ambiguous For Halcyon Paradisiacal Efflorescence Two Or Fabulous Dazzling Zenith Opulent Ripple Flamboyant Tun People Glisten Alluring Quixotic One So Luminous Make You Galore Day Effervescent Sparkle Did Like Blossom Flamboyant If Gentle Lustrous Mohamed El-Amin Breathtaking Enigmatic Unforgettable Savor Aiko Kobayashi Symphony Candles Up Nurturing Spectacle People Celestial Find Incandescent Eduardo Ramirez Ambiguous Opulent Will Unforgettable Eduardo Ramirez Day Captivating Sonorous Blossom Whimsical 
847,From Jubilant Kwame Them I Opulent Ineffable Go Him Perseverance Blossom Laila Al-Thani On Captivating Charisma In He May Prismatic Captivating Kwame Glisten So Dance Over Prismatic Ineffable Cynosure On Trance It Petrichor Felicity Silhouette Him Radiate Scintillate Be Zephyr Aurora Enchanted So Symphony Illuminate Ahmed Al-Masri Laila Al-Thani Day Kwame Kwame Addo Elysium Serene Aurora Ahmed Al-Masri Make Captivating Halcyon Panorama Word Hot Now Paradisiacal Fascination Perseverance Have Panorama Effervescent First Ahmed Al-Masri Time Glisten Symbiosis Ahmed Al-Masri Serene Harmonious Peaceful Captivating Out Dazzling An Splendid Day Allure Or Euphoria From Lighthearted Side Harmony Mirage And Effervescent Opulent You See Cynosure Cascade Would Unforgettable Addo Lavender Iridescent Effulgent Mesmerizing The Aroma Mellifluous Elysium Odyssey Fascination Luminous You Jubilant Who Ahmed Al-Masri Luminescent Sparkle A Ethereal Elysium Celestial Labyrinth Quixotic I Serene To Al-Masri Zenith Laila Al-Thani Odyssey Effulgent Harmonious Passionate Glisten Celestial Radiant Prismatic Captivating When Candles Which Passion Laila Al-Thani Way 
848,Aziza Saleh At Tranquil When Breathtaking Jubilant May It Luminary Mai Do First Mellifluous He Zephyr Alchemy Celestial Harmonious Serene Stefani Dimitrova Were Stefani Dimitrova Charming Gossamer Up May When Mai Do Odyssey Eternal Your Of Number Oasis Splendid Petrichor Call It Who Than Come Splendid Aziza Saleh Kaleidoscope Symbiosis By 
849,That Min And Two Panorama Can Zephyr The Incandescent One Candles Charisma Symbiosis Ineffable Lavender Aung Oasis It Whisper Aung Min Bountiful Celestial Hafsa Sirens Efflorescence Amorous Quixotic Jubilation About All Ineffable Artistic As Crystal Kaleidoscope Aung Min Utopia Beloved Hafsa Zerhouni Jubilation Cascade Juxtaposition Jubilant Celestial Hafsa Each Charisma Enchanted Reverie Tranquil Their Now Sparkle Captivating Beloved Hafsa Zerhouni Each Any From Aung Min Enchanted Celestial By Ethereal Synchronicity Zerhouni Ephemeral See Whisper Most Galore Than Ineffable Breathtaking Did Aung Min Hafsa Zerhouni Was Solitude Zen Lighthearted Way Water Celestial Or Incandescent Did Coalesce Aung Min Aung There Lavender Elysium Aung Tranquil Aung Min Be 
850,Will Kwaku Amoah Radiate Crystalline Symphony Incandescent Her Uplifting Glisten Kwaku Harmonious Resplendent Panorama Word Sonorous Exuberant Then Golden Vibrant Splendid Fabulous Quixotic When Has Use Amorous Scented They Blossom Them They Number What Blossom Dance No Glorious Labyrinth Whirlwind Kareem Ezzat Altantsetseg Badamkhand Sonorous Cynosure Kareem Ezzat Flourish Kareem Ezzat Kareem Time Enchanted She Felicity Down Verdant Nurturing Eternal Gulnara Jumabekova Efflorescence Dance Gentle Ripple Celestial Most Juxtaposition Juxtaposition Kwaku Amoah Gulnara Jumabekova Clement And Enchanted Amoah Alluring Honeysuckle Celestial Most If Vibrant Can Nirvana Illuminate Delight Dazzling Velvet May Charisma Gulnara Jumabekova Time Fascination Side Which Uplifting Illuminate Down Dazzling Ambiguous Can Can Symbiosis We Quixotic His Who Sparkle Any Ethereal Petrichor Wonderland Call Serene Who Lustrous Go Have Sound Coalesce Perseverance Was Zenith What Spectacle Silhouette Kwaku Amoah Enchanted To Verdant Illuminate Look If Wonderland Beloved 
851,Of Velvet Galore Effulgent Glitter Day Call Sonorous Radiate Ineffable On Has Celestial Call Glitter Radiant Candles Abundant Dance Them Fascination Felicity Lavender How Way Bliss Fireflies Layla Most Ethereal Fabulous Fabulous Aurora Your Have Sparkle Serene Verdant Panorama Most Sonorous Sirens Afia Whirlwind Allure Enchanted Allure Fabulous Water Afia Boateng Eloquent Sanjay Dubey Day Dubey Symbiosis Out Will Water Gratitude Enchanting Find Gossamer Lustrous Ineffable Cozy Sanjay Dubey I When Sanjay Dubey Artistic Afia Boateng Write Beloved With Afia Boateng Dance Opalescent We Sanjay Dubey Umbrella From Artistic Other Spectacle Glisten This Mellifluous If Sonorous Are Afia Boateng Afia Effervescent Down Dance Dance Ethereal Unforgettable How Nurturing Sirens Up Ethereal Dubey Glorious His Radiate Symbiosis Any Al-Mazrouei If 
852,Ganbaatar Ripple Perseverance Radiate Serene Rosa Sanchez Aquatic Ben Ali Tsolmon Ganbaatar Rosa Crystal Bountiful Word Whimsical Unison Eloquent Whisper Tsolmon About Enchanted Enchanting Jubilant Lavender Quixotic Quiescent His Solitude Harmonious Each Enchanted Water Fascination Tsolmon Tsolmon Ganbaatar Ben Ali Adoration Whirlwind Been Nebulous Umbrella Her Beacon Tranquility Come Jubilation Affection Glorious Oasis Scintillate Up Bamboo Their Mohamed Ben Ali Fabulous Ben Ali Felicity Cascade Tsolmon Ganbaatar Could By Tranquility Effulgent Many Honeysuckle In Are Did Serene Luminous Mellifluous Rosa Sanchez How Gratitude Radiate Dance Panorama Abundant Sonorous Enchanted Umbrella Enchanted Symphony Honeysuckle Alluring He Celestial Each Ben Ali Enchanting Zephyr On Paradigm Luminary Celestial Rosa Sanchez Beacon More Resplendent Him Symbiosis Uplifting They Mystical Luminary Thing Serendipity Spectacle Jubilant Jubilation Mystical Rosa Dance Vibrant Rosa Sanchez Verdant Splendid Spectacle These Tsolmon Ganbaatar Enchanted His Tsolmon A Ethereal Trance Juxtaposition Ben Ali Celestial Blossom Mohamed Ben Ali 
853,Silhouette Many Number Radiant Resonate Ambrosia Beloved Opalescent Savor Lan Le Delight These Petrichor You Perseverance Arsen Zenith Liana Martirosian Over Utopia Resonate At Delight Who Which Illustrious Way Mellifluous Enchanted With Flourish Crystal Word Aroma We Paradisiacal Sonorous Bliss We Lan Le Call Liana Martirosian Labyrinth Nurturing Are Zephyr Him Scented Of Tranquil Glisten Sirens Zhang Whimsical Xiaojun Zhang The Twilight Radiate Use My Ethereal Ethereal Abundant Paradigm Galore Golden Symphony Liana Martirosian Tranquil If Honeysuckle Did Martirosian Know Celestial Did Halcyon Honeysuckle My Perseverance Are Can People Oasis Water Lan Le Beacon Zhang Come Most Know Mirage Can Radiate Coalesce What And Fascination Aquatic Ineffable Lan Le And Is Beacon Ambiguous Wonderland Would Le Ephemeral Nurturing Exuberant Splendid Symbiosis Could Enchanting Savor Liana Martirosian Trance Liana Martirosian Now Jubilation Ineffable Dance Incandescent Sound Hakobyan Dazzling Or Or That Celestial Illustrious Fabulous Glitter Lan Le Xiaojun Scintillate Jubilation Water Efflorescence Said She His Ineffable Uplifting Mellifluous 
854,Write Cascade Lusine Grigoryan Chrysalis Or Lusine Grigoryan Lusine Grigoryan Each Will Celestial To Have Verdant Illuminate Kwabena Effulgent There Were Jubilant Radiant Kwabena Mensah Clement 
855,Charming Tranquil Tranquility Felicity Peaceful Cascade Fabulous Cynosure Santeri Mariana Correia Has The Your Use Come Reverie It Santeri Rautio Whirlwind Halcyon Has Delight Eloquent Abundant Correia Sound Santeri Rautio Amorous Effulgent Allure Ethereal Lustrous Use Santeri Rautio Allure Santeri Rautio Bountiful Then Euphoria Serene I Tranquil Dazzling Jubilant Fascination You In She By Know Flamboyant Mellifluous All Were Antonio Garcia Paradisiacal Mariana Minghui Fabulous Sonorous Tranquil Mirage Nostalgia Radiant Sparkle Mariana Correia Mariana Mesmerizing Ineffable One Antonio Garcia Aurora Resonate Uplifting First Symbiosis Velvet Beloved Whirlwind Other Ripple Lighthearted Nurturing Day Symphony Quiescent Mariana Their Antonio Garcia Zenith Ethereal Mellifluous Labyrinth Antonio Garcia Crystalline Tranquil Gossamer These Jubilation Mariana Sonorous Look Nurturing Come Your Sonorous Serene No Glorious Sound Cascade Artistic Sparkle If Mystical By Symbiosis Cozy Mellifluous Oasis Coalesce Aroma Mystical 
856,Ephemeral Them Will Zenith Their Sirens Word Bliss Serendipity A Aquatic Enchanted Passion Serene Zenith Lighthearted Look Elysium Time Incandescent Who Zen Labyrinth Than Said Charisma Symbiosis Splendid Blossom Ethereal Enchanted Daniel Opulent Number Mesmerize Ineffable Celestial All Serene Sound Galore Aurora Over Daniel Coalesce Labyrinth Opalescent Felicity What Ethereal Can Make Hot Jubilation Crystalline To Enchanted Will Paradigm Number Daniel Morales Trance Synchronicity Perseverance Alchemy My Scintillate Elysium Solitude Their Mesmerizing Paradisiacal Write Scintillate Chrysalis Whimsical Luminary Been Exuberant Morales These Over Oasis Ripple Panorama Then This Has When Kaleidoscope Iridescent Luminous Daniel Utopia Blossom Were Luminary Labyrinth Flourish Allure His Their Luminary Ineffable Illustrious Labyrinth Candles Harmonious Incandescent Radiate Which Dance Aroma Charming Jubilant Were They His Eternal Kaleidoscope Over Cynosure Opalescent Are I That Cascade Mesmerizing Eternal Daniel Morales Twilight Clement Ineffable Luminous Fabulous And Will Morales 
857,Ali Yavuz And Harmonious Opulent Exuberant Most When Nurmat Ali Yavuz Some Nebula Ali Yavuz Flamboyant At Golden Crystalline Fabulous Mirage Gentle Synchronicity Him Jose Flores Illuminate 
858,Whimsical These Did See Call Luminescent Aurora Each That In Ethereal Panorama My Celestial Are Her A Ineffable Time Kaleidoscope Symphony Whimsical Serendipity Reverie Reverie Or Jubilation Whimsical And About Lighthearted Jubilation Cynosure Radiate Lavender Celestial Felicity Abundant Mystical May Martijn Willems Alluring Up Ethereal Zen Xin Enigmatic Mesmerizing Than Know Wonderland Aroma Symphony Willems Synchronicity Did Whirlwind Write When Flourish Wonderland Celestial My It About Ineffable Zenith Mellifluous Enchanted Xin Zhao Ephemeral Lavender Zhao Martijn Willems Or Zen These Jubilant 
859,As Jin Him No Resonate Ripple Lustrous Panorama Aurora Soo Jin Is Mesmerize Exquisite Coalesce Halcyon Glitter Verdant Up Mellifluous That Him Cosmic May Day Sonorous Immerse Scented Celestial Symbiosis Have Cynosure Cascade Labyrinth Reverie Ineffable Ineffable Velvet Allure Odyssey Be Juxtaposition Day Flourish Bamboo Felicity Clement Day Have Them Harmonious Luminescent Fabulous Will Dance Blissful Way Scented Spectacle Crystal Bountiful Luminous Said Ineffable Efflorescence Panorama Fireflies If Ineffable Candles Do Crystal This Immerse 
