,Unmasked
0,"Thomas Wilson strolled down the street, pausing periodically as he took in his surroundings. He walked past a myriad of bustling shops, dodging passersby as he made his way to a new destination. The early morning air was chilly, but Thomas Wilson's spirit was undeterred as his gaze observed the familiar yet unfamiliar sights. After what felt like miles of walking, he arrived at his intended destination. Taking a deep breath of fresh air, Thomas Wilson stepped through the door, ready to start a new day."
1,"Safiya Al-Haddad weathered life's storms with a courage and determination unmatched by any other. Even in the worst of circumstances, Safiya's confidence and strength never faltered. The lessons she learned and the battles she fought were nothing to be taken lightly, and especially not to be taken for granted. Life, for Safiya, was not only a road of ups and downs- it was a way of life, something that she embraced, and ultimately succeeded at. Everywhere she went, she left a trail of positivity and light behind her, proving to the world that one person's grit and ambition can lead the way for many more."
2,"Elizabeth Baker opened her eyes to a sun-filled room, feeling a warm ray of peace that spilled across her face. She dusted off her arms as she rose from her bed, ready to start a brand new day full of possibilities. She made her way to her closet and found just the right outfit for the day-- a light purple dress with a pleated skirt, accented with her favorite silver jewelry. She tried on a pair of comfortable shoes and grabbed a fresh white cardigan for the cooler morning air. As she stepped outside, she took a deep breath and felt the air around her, ready for whatever awaited her. Elizabeth Baker was ready to take on the world."
3,"Vladimir Petrov was a man of many talents. He was an engineer, inventor, and artist. He spent his life pursuing ideas that no one else believed in, from inventing a new kind of robotics to creating unique and intricate paintings. No matter the task, Vladimir Petrov was determined to make something beautiful, something powerful, or something new. He was constantly pushing himself and learning new techniques to reach the goal he was striving for. Even when everyone else thought it was impossible, Vladimir Petrov found a way, pushing boundaries and creating something that no one else had ever done before. He was determined to make the world a better place with creativity, innovation, and purpose. Though his life and legacy may have been cut short, his ambition and determination will live on in every life he touched and every creation he left behind."
4,"Selim Demirtas had it all: a successful career, a loving family, and a bright future. But when his health suddenly began to fail, his life changed forever. He was diagnosed with a terminal illness, and given a short time to live. Still, he faced life with grace and dignity, cherishing every moment with his loved ones. His legacy of courage, compassion and strength will stay with them forever. No matter how long or short his life was, Selim Demirtas will always be an inspiration, a reminder to those he left behind that true courage can be found in the face of adversity."
5,"Tarek Samir was always an ambitious person. He was never content to just accept the status quo and quietly accepted whatever life threw at him. He was determined to leave his mark on the world, so he studied hard and put in as much effort as necessary to become the best in his chosen field. With his impressive dedication and hard work, Tarek Samir soon found himself achieving success beyond his wildest dreams. He rose through the ranks quickly and became a leader in his industry, making a name for himself and paving the way for many others to follow in his footsteps. Now, years later, Tarek Samir's commitment and hard work have paid off and he stands as a shining example of what it takes to reach success in any endeavor."
6," Dmytro Sidorov had been a fixture of the community for years. He was well-known for his generous heart and willingness to help anyone in need. He started numerous charities and donations to local organizations and even opened a soup kitchen in his hometown. He was admired by many for his optimism and compassion. It was a shock to the community when the news of Dmytro Sidorov's untimely passing broke. He may be gone, but his legacy lives on. To this day, many of the charities and donations he set up are still functioning and helping those in need. His spirit lives on in the life of those he helped. Dmytro Sidorov will always be remembered for his kindness and generosity."
7,"Wimonrat Khunthong stood in front of his classroom of attentive students and began his lecture. He had been teaching at the esteemed university for near a decade and had garnered the respect of everyone in the room.  Wimonrat was an excellent teacher, proficient in his subject and passionate in his method of delivery. His students were always eager to learn from him and often found themselves looking forward to coming to class. Wimonrat's teaching style was unique, as he always encouraged dialogue and interaction. He listened intently to every question his students had and always pushed them to go further. His dedication to his subject and to his students was unmatched, and his enthusiasm was contagious. It was no wonder everyone had grown so fond of Wimonrat Khunthong."
8,"Tungalag Tumendelger was born in the small village of Oughoud, deep in the northern region of Mongolia. Raised in a traditional, nomadic family, Tungalag was deeply rooted in his culture and heritage. He traveled extensively throughout his life, taking part in the traditional nomadic culture of his native country. Despite facing immense adversity, including natural disasters and extreme weather, Tungalag remained diligent in his efforts to succeed. He was a natural leader and often implemented strategies that would benefit the entire village. As a result, he earned the respect and admiration of his peers. Tungalag's ambition and desire to achieve drove him to set goals for himself and pursue them with tenacity. Ultimately, his hard work and resilient attitude paid off and he achieved his lifelong dream of becoming a successful entrepreneur. Tungalag Tumendelger is a living example of how hard work and determination can lead to success."
9," Ivan Smirnov had always been a bit of an oddity. Growing up in rural Russia, his peers ostracized him for his strange behaviors and eccentric interests. He refused to conform to their standards, instead putting all of his energy into his dynamics and mathematics classes. Many of the townspeople scoffed at his ambition, believing that his strange passions would lead him nowhere. They were sorely mistaken. Ivan's hard work paid off in spades – soon, he was applying to universities, and before long, he had earned himself a degree specializing in physics. With newfound opportunities in front of him, Ivan knew he had to make the best of them, and so he set out to make a name for himself. He conducted groundbreaking research on the mechanics of machinery and the structures of particles, writing books and giving lectures across the globe. Before long, Ivan Smirnov became synonymous with success. His achievements earned him a place in history, and his name will always be remembered as a sign of dedication, ambition, and resilience."
10,"Maryam Al-Khater stood tall, a beacon of strength and courage in her small village. She had faced hardships few of her neighbors could imagine and had emerged from each one with newfound faith. A hardworking woman, Maryam provided for her family and offered much-needed guidance to the younger generations. She had built a legacy within her village and the wider region, as a role model of the accomplishments achievable despite the many obstacles placed before her. Maryam Al-Khater's indomitable spirit was an inspiration to her people and all who had the pleasure of crossing her path."
11," Akio Kumari was a lifelong dreamer. Even as a child, the possibilities and prospects of unexplored paths and adventures spurred Akio's imagination. A natural aptitude for the sciences and a sharp eye for detail revealed a determined yet gentle intellect early on. Whether fiddling with engines or mapping the stars, Akio's curiosity was insatiable. As a young adult, Akio set out to explore the farthest corners of the world, discovering new wonders and taking part in a storied legacy that had persisted for generations. Despite the many dangers encountered on the arduous journey, Akio remained brave and determined. With each new discovery, Akio remembered the power of the human spirit to endure against all odds. Akio Kumari was an explorer from a bygone age. His adventures will be remembered and cherished for generations."
12,"Fatima Ahmed strode through the park, her face determined and her eyes sharp. Everywhere she looked, it seemed the world around her was enveloped in a blanket of subdued colours, every gradient slightly different than usual. It amazed her how a name, just hers, could be at once both a blessing and a curse. As she walked, she could feel everyone's eyes on her: the judgement, the expectation, and the fear. She could not allow herself to succumb to the pressures they put on her. It was a challenge she knew she would have to face head-on, so to prove to them all that Fatima Ahmed was not one to be underestimated."
13," Laura Machado was always a lover of the outdoors. Though she was born and raised in the city, every weekend she could be found roaming the nearby vistas, savoring the simple joy of being alive. In a world of polluted air and commercialized apathy, she found solace in immersion in nature, often disappearing for hours under early morning sunlight dripping through silent, dewy forests.As she aged, Laura's passion for the environment only intensified. After college, she decided that she wanted to ensure future generations were able to experience a healthy and balanced natural world. She joined various environmental conservation organizations and even used her technical skills to track animal populations and help regulate hunting and fishing in her region.Sometimes, when she was alone on her hikes, Laura thought about what she could do to make the world a better place. She knew that her contribution was something small, but she still felt she had a hand in the in the greater picture: preserving and protecting the environment for those that came after her. Laura Machado was a true champion of the outdoors and a source of inspiration to those lucky enough to have known her."
14,"Liza Pascual had been walking through the forest for what felt like hours. She had come here in hopes of finding some peace of mind, a meditation of sorts. Little did she know, the deeper she ventured, the more wonders she discovered. Every rock, every tree, every breeze, all breath-taking in its own unique way. Suddenly, she could feel something different about the air, almost as if something was watching her from the shadows. Goosebumps ran up her arms as she quickly spun around. Nothing. Shaking, she continued on her path. Taking one step and then another, she felt her courage strengthen and her curiosity pushed her along. She sang softly and smiled, feeling an emotion, she couldn't quite name, wash over her. It was a feeling of tranquility, belonging even. The forest was surprisingly beautiful and she found pleasure in each new discovery. Peddles crunched with each step and the birds chirped their encouragement. Maybe she'd stay here for a while, she thought. Anywhere is better than home. Liza Pascual smiled to herself, content with the world and her place in it."
15,"Antonio Fernandez was unlike any other. Born into a family of humble beginnings, he was determined to make something more out of himself and break the boundaries of his small world. He worked hard, often forgoing sleep in order to study for countless hours, and eventually succeeded in garnering a coveted position in a big city law firm. His professional accomplishments were only amplified when he was asked to volunteer for a special project from the mayor himself. Antonio Fernandez had once been a small fish in a big pond, but now he was making a name for himself. People were recognizing him for his dedication and determination, and he was not about to rest on his laurels. With his ambition and drive, Antonio Fernandez was set to make an even bigger impact in the world."
16," Salma Chafik was a woman of unparalleled strength and ingenuity. Everywhere she went she was praised and admired; Her tenacity, her will-power and ambition were characteristics that she was known for, but it was her ability to think with both conviction and clarity that set her apart. She applied this same attitude to her work, constantly striving to break boundaries and push her own perceived limits. Salma Chafik was an innovative thinker and a pioneer of her time; her ideas and contributions to the world are invaluable, and her legacy will continue to inspire for generations."
17," Sanjay Dubey emerged from an ivy-clad cottage with a mysterious glint in his eye and the air of a man on a mission. Never one to be intimidated by a challenge, Sanjay soon found himself at the center of the most daunting mission of his life. With courage and wit, he confidently faced each obstacle head on, always striving for better outcomes than expected. His journey eventually led him to the coveted peak of achievement, making him a beacon of hope to anyone who has ever dared to dream big. Sanjay Dubey has proven himself to be a masterful example of what it takes to succeed."
18," Inês Moreira was always an ambitious and motivated individual. She had a dream to become a successful businesswoman, and she worked hard to make that dream a reality. From an early age, Inês had an appetite for learning and discovering new things. She was also a creative problem solver; when she encountered an obstacle, Inês was never afraid to try something new. When she graduated from college with a degree in business, Inês quickly made a name for herself in the business world. She started her own successful company and was soon traveling the world to attend conferences and give speeches. Inês’s hard work, determination and creative problem-solving skills are an inspiration to us all."
19," Rajesh Adhikari had been handed a great opportunity to make something of himself, something special that nobody else could do. It was a challenge he had never faced before but he was determined to rise to it. His courage and ambition were remarkable and despite the odds stacked against him, he succeeded. People quickly saw the potential in Rajesh and he was soon propelled to the limelight, where his talents and accomplishments earned him the admiration and respect of many. He became known for his remarkable ability to take on difficult projects and tasks that others couldn't even come close to completing. Now, his name has become synonymous with success and achievement. Rajesh Adhikari's achievements are extraordinary and will continue to be remembered for generations to come."
20,"Rosa-Linda Garcia was not like the other kids her age; she had a drive and ambition that set her apart. She was constantly pushing herself to be the best she could be, juggling long days of classes and complex homework assignments with after-school jobs and extracurricular activities. She was not content to rest on her laurels either, frequently striving to learn more, and never settling for less than what she knew she was capable of. Rosa-Linda never took shortcuts and was sure to take the time to do tasks thoroughly and correctly. Her meticulous work ethic and ambitious spirit meant that whatever Rosa-Linda Garcia put her mind to was sure to be a success."
21,"Khoa Phan was no stranger to adventure. For as long as he could remember, he had explored the world around him. From deserts to forests to snow-blanketed mountains, he thought he knew it all until one day he stumbled upon an uncharted land. His curiosity was insatiable and he was determined to uncover the mystery hidden within the forbidden zone. He ventured into the unknown, facing the unknown and discovering the secrets that had been hidden over the years. Though he could not uncover the answer to the land's enigma, he found a greater appreciation for the beauty of his world and the adventure that it offered. Khoa Phan had never been closer to discovering the true nature of the world."
22,"Siddharth Gupta had always dreamt of an exciting and innovative future, but little did he know how far his ambitions would carry him. He yearned for success and was humbled when the opportunities to explore the cutting edge of discovery were presented to him. It was in this spirit of exploration that Siddharth embraced the challenge of leading the research and development of new technologies and groundbreaking medical applications. With a combination of hard work and dedication, his ambition was rewarded and his dreams were realised as he made a lasting impact on the world. His work revolutionized the healthcare industry and shaped the future of medicine. Siddharth Gupta will always be remembered for his passion and commitment to making the world a better place."
23," Ama Darko sparkled brightly in the night, the stars in the sky seeming to imitate her own light. She walked out of the darkness, her strides powerful but delicate at the same time. It was as if time itself was standing still, allowing her to bask in the moonlight and bask in the glory of her own strength. She knew that no matter how many obstacles came her way, she was capable of anything and everything, and she would never give up. Ama Darko was a beacon of hope and determination in a world filled with despair."
24,"Amira Fathi had always been the lone star in her family. She shone brighter than her brothers and sisters and her parents knew from a young age that something special was simmering inside of her. It was no surprise when at the age of 18 she announced that she was going to attend college and moved away from the small town she had grown up in. Amira Fathi had big dreams and was determined to make them come true. She threw herself into her studies and was soon graduated, ready to conquer the world. Amira Fathi had arrived."
25,"Eman Sayed's mind filled with curiosity, pushing her ever forward. With every step she took, Eman Sayed was getting closer to uncovering the secrets that had been hidden for so long. It hadn't been easy, but she was determined to find her answers; she was determined to uncover the truth. Her journey was far from over, but she knew that with every new discovery she made, she was one step closer to uncovering the truth. She could feel that she was ready to take the final steps and reveal the secrets once and for all. With a deep breath, Eman Sayed continued forward, ready to write her own story."
26," Sarah Groen strode confidently into the boardroom, head held high. She was well aware that her success in the last quarter had made her a rising star among her peers, and she was determined to prove her worth this time too. She was the only person in the room with a plan, the only one with the information and suggestions necessary to bring the company into a successful future, and she was ready to prove it. Sarah took her position at the head of the conference table and surveyed the expectant faces around her. It was time to show these people what she was made of."
27,"Nao Sakurai was like a breath of fresh air in a stuffy office. She carried with her an undefinable quality that seemed to draw people in, inspiring conversations about art, technology, and the state of the world around them. Everywhere she went, she brought an aura of enthusiasm and joy. Her coworkers often questioned her optimism in the face of uncertain times, but Nao's response was simple: stay positive, and keep reaching for your dreams. There was something magnetic about her presence, something that made everyone feel more alive in her presence. It was hard to deny that wherever Nao Sakurai went, she left a positive impact on her surroundings."
28,"Pavel Fedorov strode through the door and into the bustling room, his leather coat sweeping through the open space. All conversation stopped, as all eyes turned to the mysterious figure of Pavel Fedorov. Fedorov's arms were crossed, his face resolute, an authority no one could deny. In an instant the room reverted to silence, as the sharp intelligence of Pavel Fedorov commanded respect in the air. No one dared question the wisdom of Pavel Fedorov, who had proven time and time again his ability to take a chaotic situation and turn it into something beautiful. As silence stretched across the room, all attention was on Pavel Fedorov, and whatever decision he commanded."
29," Nada Mustafa had been an exemplar of excellence since she was a young girl. Preternaturally gifted and intelligent, she rose to the top of every endeavor she tried. She was unafraid to challenge the status quo and push for more. Her determination and ferocity in pursuing meaningful change inspired a great many of her contemporaries. Professionally, Nada Mustafa had a very successful career, taking on high-stakes roles in different industries and organizations. In each of them, she contributed significantly to their success. Even in the face of strong opposition, she remained driven and focused on her goals. Nada Mustafa was a renowned philosopher and well-respected public figure. Her thoughtful prose and fluid rhetoric were renowned and respected. More importantly, the ideas she proposed ran so rich in symbolism and insight that no one could deny their validity. Wherever she traveled, Nada Mustafa made her presence known. She brought attention to her causes and highlighted the issues she cared about. Even in conflict-ridden areas, she remained determined and resolute, advocating for peaceful and meaningful resolutions. Nada Mustafa was, without a doubt, an extraordinary role model and"
30,"Dmitry Sokolov held the reams of paper in his hands, taking a moment before he began skimming the words. He was a man on a mission, focused relentlessly on finding the smallest detail that could be used to his advantage. It was his expertise, after all, that had propelled him to the top of the industry, and if he was going to remain among the elite, he needed to stay ahead of the rest. It was a challenge he'd risen to time and again, and this time would be no different. He shut his eyes and readied himself for the task at hand, taking deep breaths as the sea of words washed over him. Dmitry Sokolov was one of the best at what he did and nothing could stand in his way."
31," Lauri Mäkinen always knew he was destined for greatness. As a child his parents told him nothing was out of reach. With hard work and dedication he could achieve anything. Lauri had a vision to explore the world beyond his small village. With an unquenchable thirst for knowledge, he set out on his adventure. He journeyed through the open sea for months, learning more and more about himself and the world. As he ran out of supplies, Lauri encountered somebody in need. Seeing no other alternative, Lauri offered his help, not expecting anything in return. Surprisingly, the stranger presented him with a map and a small token of gratitude. Following the map, Lauri encountered something unforeseen-a vibrant, teasing adventure that in the end, fulfilled his most ambitious dreams. From that day on, Lauri would never forget what hard work and dedication had gained him and how one act of kindness can go a long way."
32," Pooja Mehta stared across the kitchen table, her mind racing, trying to find the answer to the question that had been asked of her. She knew that to give a fair and proper answer, she would need to collect her thoughts first. Leaning forward in her chair, she took a deep breath and began to sift through her memories, searching for the perfect response that would convey the depth of her knowledge. As soon as she had found the perfect phrase, or words that would captivate her listeners, she raised her head and smiled. She had the answer. Her voice was strong, confident, and her words so clear that it seemed as if they were tailor-made for her. For Pooja Mehta, the answer was effortless."
33,Dimitris Andreadis was a force of nature. Everywhere he went he brought positive energy and enthusiasm to every task he undertook. His work ethic was contagious; it was easy to get caught up in his passion and dedication. He always had a smile on his face and was never shy to offer help to those that needed it. Every team that Dimitris worked on flourished and reached new heights of success under his guidance. Dimitris was a leader in every sense of the word and his name will forever be remembered in the annals of success.
34,"Natalia Morozova was a beacon of determination and strength in the face of great difficulty. Nothing fazed her. With her cool composure, she persevered against the odds and stayed committed to her endeavors. Despite the opposition she encountered, Natalia refused to let it discourage her. She used it as motivation and pushed herself further. Natalia's resolve and spirit were contagious, and her courage inspired all who encountered it. Not anyone could boast such tenacity as Natalia Morozova."
